{
  "$schema": "https://json-schema.org/draft/2020-12/schema",
  "$id": "https://yokai-fighters.local/schema/trial.schema.json",
  "title": "Dojo training trial",
  "description": "One hand-authored dojo trial in data/trials/<id>.json (R7, YOK-105). The player gets exactly 3 attempts; landing the goal within them levels the trial's special. The goal is an ordered list of steps, each one thing the fight can observe (a Hit, Throw or block event, the dummy's state, the distance between the fighters), never a button or motion, so every trial is Kihon-completable (K2). Distances are gameplay units, frames are 60 Hz ticks.",
  "type": "object",
  "required": ["kind", "id", "status", "special", "prompt", "attempts", "setup", "goal", "rules"],
  "additionalProperties": false,
  "properties": {
    "kind": { "const": "trial" },
    "id": { "$ref": "common.schema.json#/$defs/id" },
    "status": { "$ref": "common.schema.json#/$defs/status" },
    "special": { "$ref": "common.schema.json#/$defs/id", "description": "Id of the special (kind 'special' in data/moves/) the trial levels (R7). At least one goal step must name it as its move." },
    "prompt": { "type": "string", "minLength": 1, "maxLength": 160, "description": "What the dojo shows the player, in plain words (e.g. 'Hit the dummy at mid range, then anti-air its jump')." },
    "attempts": { "const": 3, "description": "Fixed by R7: the special levels if the goal is landed within 3 attempts." },
    "setup": { "$ref": "#/$defs/setup" },
    "goal": {
      "type": "object",
      "required": ["steps"],
      "additionalProperties": false,
      "properties": {
        "steps": { "type": "array", "minItems": 1, "maxItems": 4, "items": { "$ref": "#/$defs/step" }, "description": "Met in order within one attempt; events that match no step are ignored." }
      }
    },
    "rules": { "$ref": "common.schema.json#/$defs/ruleIds" },
    "notes": { "$ref": "common.schema.json#/$defs/notes" }
  },
  "$defs": {
    "setup": {
      "type": "object",
      "required": ["distance", "attempt_frames", "dummy"],
      "additionalProperties": false,
      "properties": {
        "distance": { "type": "integer", "minimum": 120, "maximum": 1240, "description": "Start distance between the fighters' centres, gameplay units (body width 120 .. max separation 1,240, SimConfig, AM9 proposed)." },
        "attempt_frames": { "type": "integer", "minimum": 60, "maximum": 3600, "description": "Ticks one attempt lasts before it counts as failed." },
        "dummy": { "$ref": "#/$defs/dummy" }
      }
    },
    "dummy": {
      "description": "What the dummy does. idle/crouch/guard/crouch_guard hold that stance; jump jumps straight up; attack plays `moves` in order (a string). The first jump or string starts on tick 1 of each attempt and the next every `every` ticks after, so `every` may not be longer than setup.attempt_frames (the validator and the loader check it).",
      "type": "object",
      "required": ["action"],
      "additionalProperties": false,
      "properties": {
        "action": { "enum": ["idle", "crouch", "guard", "crouch_guard", "jump", "attack"] },
        "moves": { "type": "array", "minItems": 1, "maxItems": 4, "items": { "$ref": "common.schema.json#/$defs/id" }, "description": "attack only: move ids from the dummy's kit, played as a string." },
        "every": { "type": "integer", "minimum": 1, "maximum": 600, "description": "jump and attack: ticks from one start to the next (first start = tick 1 of the attempt); at most setup.attempt_frames." }
      },
      "allOf": [
        { "if": { "properties": { "action": { "enum": ["jump", "attack"] } } }, "then": { "required": ["every"] }, "else": { "not": { "required": ["every"] } } },
        { "if": { "properties": { "action": { "const": "attack" } } }, "then": { "required": ["moves"] }, "else": { "not": { "required": ["moves"] } } }
      ]
    },
    "step": {
      "description": "One observation. hit = the player's strike or projectile connects unblocked (Match.Hit); a landed throw also raises Match.Hit but does not count as a hit or toward a combo. combo = `count` unblocked strike/projectile hits with the dummy held between them (its state is Hitstun, Knockdown or Thrown on every tick from one hit to the next; a dummy that recovered and jumped has left the combo). throw = the player's throw lands (Match.Throw, Land). block = the player blocks `count` of the dummy's hits. block and counter need a dummy with action 'attack'. Kata-only inputs (motion, precision) are not allowed (K1, K2).",
      "type": "object",
      "required": ["event"],
      "additionalProperties": false,
      "properties": {
        "event": { "enum": ["hit", "combo", "throw", "block"] },
        "move": { "$ref": "common.schema.json#/$defs/id", "description": "hit: the strike or projectile that connects (not a throw); throw: the throw that lands; combo: a move that must be one of the combo's hits. Absent = any." },
        "count": { "type": "integer", "minimum": 1, "maximum": 10, "description": "hit/block: how many (default 1); combo: hits in one combo (2 or more, required)." },
        "counter": { "type": "boolean", "description": "hit only: must be a counterhit (C7), i.e. the dummy was in a move of its own when hit - any frame of it, startup and active included, not only recovery. Needs a dummy with action 'attack'." },
        "dummy_state": { "enum": ["airborne", "grounded", "landed"], "description": "hit/throw: the dummy's state on the sampled tick. A hit is sampled on the tick it connects. A throw is sampled on the tick its GRAB connects (the land comes break_window + 1 ticks later, with the dummy held on the ground), so 'throw it as it lands' is dummy_state landed on the grab. landed = not airborne on the sampled tick and airborne on one of the `landed_within` ticks before it. A throw cannot grab an airborne dummy (C4)." },
        "landed_within": { "type": "integer", "minimum": 1, "maximum": 60, "description": "Required with dummy_state 'landed', not allowed otherwise." },
        "distance": {
          "type": "object",
          "additionalProperties": false,
          "minProperties": 1,
          "properties": {
            "min": { "type": "integer", "minimum": 0, "maximum": 1240 },
            "max": { "type": "integer", "minimum": 0, "maximum": 1240 }
          },
          "description": "hit/throw: distance between the fighters' centres on the sampled tick (hit: when it connects; throw: when the grab connects, before the land's slide), gameplay units."
        },
        "motion": { "not": {}, "description": "Kata only (K1): a trial must be Kihon-completable (R7, K2)." },
        "precision": { "not": {}, "description": "Kata only (K1): the motion-input precision bonus cannot be asked for (R7, K2)." },
        "kata": { "not": {}, "description": "Kata only (K1): a trial must be Kihon-completable (R7, K2)." }
      },
      "allOf": [
        { "if": { "properties": { "event": { "const": "combo" } } }, "then": { "required": ["count"], "properties": { "count": { "minimum": 2 } } } },
        { "if": { "properties": { "event": { "const": "block" } } }, "then": { "not": { "anyOf": [ { "required": ["move"] }, { "required": ["dummy_state"] }, { "required": ["distance"] }, { "required": ["counter"] } ] } } },
        { "if": { "properties": { "event": { "const": "combo" } } }, "then": { "not": { "anyOf": [ { "required": ["dummy_state"] }, { "required": ["distance"] }, { "required": ["counter"] } ] } } },
        { "if": { "properties": { "event": { "const": "throw" } } }, "then": { "not": { "anyOf": [ { "required": ["counter"] }, { "required": ["count"] } ] }, "properties": { "dummy_state": { "enum": ["grounded", "landed"] } } } },
        { "if": { "properties": { "dummy_state": { "const": "landed" } }, "required": ["dummy_state"] }, "then": { "required": ["landed_within"] }, "else": { "not": { "required": ["landed_within"] } } }
      ]
    }
  }
}
