{
  "kind": "trial",
  "id": "oni-quake-trial",
  "status": "proposed",
  "special": "oni-quake",
  "prompt": "Slam Oni Quake into a standing guard: the low shock breaks it.",
  "attempts": 3,
  "setup": {
    "distance": 260,
    "attempt_frames": 600,
    "dummy": {
      "action": "guard"
    }
  },
  "goal": {
    "steps": [
      {
        "event": "hit",
        "move": "oni-quake"
      }
    ]
  },
  "rules": [
    "R7",
    "K1",
    "K2",
    "K3",
    "F3",
    "C3"
  ],
  "notes": "Teaches that Oni Quake hits low (C3): the dummy blocks standing, so only a low connects. The dummy never attacks, so it is completable on the first try despite the 27-frame startup. Distance 260 puts the dummy inside the box (x 110-310). Kihon: down + Special, slot D. Harness to confirm."
}
